{
  "schema_version": "1.2",
  "card_id": "sl-card-0064",
  "方法名": "主语替换技巧",
  "方法层级": "批改二稿",
  "适用题型": [
    "综合分析"
  ],
  "适用模式": [
    "修改二稿",
    "批改",
    "解析"
  ],
  "适用环节": [
    "组织结构"
  ],
  "任务原型": "综合分析题",
  "触发信号": [
    "需要通用化表达",
    "保留具体地名"
  ],
  "材料结构特征": [
    "无明显结构特征要求"
  ],
  "输入条件": [
    "答案"
  ],
  "诊断项": "是否过于具体",
  "步骤逻辑": [
    "识别具体地名",
    "替换为通用词",
    "核验"
  ],
  "常见错误": [
    "保留具体地名"
  ],
  "修改动作": [
    "替换地名",
    "若过于具体，需替换"
  ],
  "影响评分维度": [
    {
      "题型": "综合分析",
      "维度名": "组织表达",
      "影响程度": "中"
    }
  ],
  "输出产物": [
    "通用化表达"
  ],
  "适用边界": [
    "综合分析题"
  ],
  "质量等级": "B"
}