{
  "schema_version": "1.2",
  "card_id": "sl-card-0060",
  "方法名": "不冒险连连看检查法",
  "方法层级": "批改二稿",
  "适用题型": [
    "提出对策"
  ],
  "适用模式": [
    "修改二稿",
    "批改",
    "解析"
  ],
  "适用环节": [
    "批改"
  ],
  "任务原型": "提出对策题",
  "触发信号": [
    "需要检查匹配",
    "问题对策脱节"
  ],
  "材料结构特征": [
    "无明显结构特征要求"
  ],
  "输入条件": [
    "问题清单、对策清单"
  ],
  "诊断项": "问题对策是否匹配",
  "步骤逻辑": [
    "列出问题",
    "列出对策",
    "逐一连线检查",
    "补充无对应的"
  ],
  "常见错误": [
    "问题对策脱节"
  ],
  "修改动作": [
    "补充无对应的对策",
    "若不匹配，需调整"
  ],
  "影响评分维度": [
    {
      "题型": "提出对策",
      "维度名": "针对匹配",
      "影响程度": "中"
    },
    {
      "题型": "提出对策",
      "维度名": "可行具体",
      "影响程度": "中"
    }
  ],
  "输出产物": [
    "匹配检查结果"
  ],
  "适用边界": [
    "提出对策题"
  ],
  "质量等级": "B"
}