{
  "schema_version": "1.2",
  "card_id": "sl-card-0073",
  "方法名": "开头篇幅检查",
  "方法层级": "批改二稿",
  "适用题型": [
    "申发论述"
  ],
  "适用模式": [
    "修改二稿",
    "批改",
    "解析"
  ],
  "适用环节": [
    "批改"
  ],
  "任务原型": "申发论述题",
  "触发信号": [
    "开头过长",
    "开头没有完成必要引题或立意"
  ],
  "材料结构特征": [
    "无明显结构特征要求"
  ],
  "输入条件": [
    "答案"
  ],
  "诊断项": "开头篇幅是否合理，是否完成必要引题与立意",
  "步骤逻辑": [
    "根据总字数、题目任务、全文结构判断开头篇幅是否合理",
    "检查开头是否完成必要引题与立意",
    "不以固定行数判断开头是否过长"
  ],
  "常见错误": [
    "以固定行数机械判断开头长度",
    "忽略开头是否完成必要功能"
  ],
  "修改动作": [
    "根据全文结构调整开头篇幅",
    "确保开头完成引题与立意"
  ],
  "影响评分维度": [
    {
      "题型": "申发论述",
      "维度名": "结构",
      "影响程度": "中"
    },
    {
      "题型": "申发论述",
      "维度名": "语言",
      "影响程度": "中"
    }
  ],
  "输出产物": [
    "验证结果"
  ],
  "适用边界": [
    "申发论述题",
    "仅为辅助预判或复核信号，不构成固定答案格式，不得覆盖题目要求、材料证据和评分协议，不得因不符合经验数值直接扣分"
  ],
  "质量等级": "B"
}
