{
  "schema_version": "1.2",
  "card_id": "sl-card-0032",
  "方法名": "综合分析解题四步法",
  "方法层级": "题型工作流",
  "适用题型": [
    "综合分析"
  ],
  "适用模式": [
    "修改二稿",
    "批改",
    "解析"
  ],
  "适用环节": [
    "审题"
  ],
  "任务原型": "综合分析题",
  "触发信号": [
    "要求\"谈谈理解\"\"分析\"",
    "跳过某些步骤"
  ],
  "材料结构特征": [
    "无明显结构特征要求"
  ],
  "输入条件": [
    "题目文本、材料文本"
  ],
  "诊断项": "是否完成所有步骤",
  "步骤逻辑": [
    "审题（判断类型）",
    "找点（定位材料）",
    "分类（按要素分类）",
    "对号（代入答案）"
  ],
  "常见错误": [
    "跳过某些步骤"
  ],
  "修改动作": [
    "补充缺失步骤",
    "若步骤缺失，需补充"
  ],
  "影响评分维度": [
    {
      "题型": "综合分析",
      "维度名": "任务符合",
      "影响程度": "低"
    }
  ],
  "输出产物": [
    "完整答案"
  ],
  "适用边界": [
    "综合分析题"
  ],
  "质量等级": "A"
}