{
  "schema_version": "1.2",
  "card_id": "sl-card-0008",
  "方法名": "材料关系核验",
  "方法层级": "能力内核",
  "适用题型": [
    "归纳概括",
    "综合分析",
    "提出对策",
    "贯彻执行",
    "申发论述"
  ],
  "适用模式": [
    "解析",
    "批改",
    "对照参考答案",
    "修改二稿"
  ],
  "适用环节": [
    "要点提取"
  ],
  "任务原型": "所有申论题目",
  "触发信号": [
    "要点之间关系不清",
    "有总分/并列/因果关系",
    "把总分关系误判为并列关系"
  ],
  "材料结构特征": [
    "有总分/并列/因果关系"
  ],
  "输入条件": [
    "候选要点池"
  ],
  "诊断项": "是否有独立得分性",
  "步骤逻辑": [
    "识别要点间关系（总分/并列/因果）",
    "判断独立得分性",
    "核验材料证据"
  ],
  "常见错误": [
    "把总分关系误判为并列关系"
  ],
  "修改动作": [
    "删除无独立得分性的要点",
    "若要点重复，需合并"
  ],
  "影响评分维度": [
    {
      "题型": "归纳概括",
      "维度名": "要点覆盖",
      "影响程度": "高"
    },
    {
      "题型": "归纳概括",
      "维度名": "准确有据",
      "影响程度": "中"
    },
    {
      "题型": "综合分析",
      "维度名": "要点覆盖",
      "影响程度": "高"
    },
    {
      "题型": "综合分析",
      "维度名": "关系逻辑",
      "影响程度": "中"
    },
    {
      "题型": "提出对策",
      "维度名": "问题诊断",
      "影响程度": "高"
    },
    {
      "题型": "提出对策",
      "维度名": "针对匹配",
      "影响程度": "中"
    },
    {
      "题型": "贯彻执行",
      "维度名": "内容覆盖",
      "影响程度": "高"
    },
    {
      "题型": "申发论述",
      "维度名": "材料运用",
      "影响程度": "高"
    },
    {
      "题型": "申发论述",
      "维度名": "论证深度",
      "影响程度": "中"
    }
  ],
  "输出产物": [
    "核验后的要点清单"
  ],
  "适用边界": [
    "所有题型"
  ],
  "质量等级": "A"
}