{
  "schema_version": "1.2",
  "card_id": "sl-card-0034",
  "方法名": "任务与措施总分结构法",
  "方法层级": "题型工作流",
  "适用题型": [
    "提出对策"
  ],
  "适用模式": [
    "修改二稿",
    "批改",
    "解析"
  ],
  "适用环节": [
    "组织结构"
  ],
  "任务原型": "提出对策题",
  "触发信号": [
    "需要组织对策",
    "有总分关系",
    "只有并列没有总分"
  ],
  "材料结构特征": [
    "有总分关系"
  ],
  "输入条件": [
    "对策清单"
  ],
  "诊断项": "是否有总分结构",
  "步骤逻辑": [
    "先判断题面和材料是否确有上位总任务或分类逻辑",
    "有总分关系时，用简短总括语统领各类措施",
    "无总分关系时，直接按问题或措施并列分条，不强造总起句",
    "只要层次清晰且措施不混杂，并列结构与总分结构均可成立"
  ],
  "常见错误": [
    "材料明有上位任务却缺少必要的分类统领",
    "材料只有并列措施却为了套模板硬加空洞总起句"
  ],
  "修改动作": [
    "有真实总分关系时补充简短统领语",
    "并列已清晰时保持直接分条，删除空洞总起句",
    "只在结构混乱或类别交叉时调整组织方式"
  ],
  "影响评分维度": [
    {
      "题型": "提出对策",
      "维度名": "组织表达",
      "影响程度": "中"
    }
  ],
  "输出产物": [
    "总分结构答案"
  ],
  "适用边界": [
    "提出对策题",
    "总分结构是可选组织工具，不是每道对策题的必备格式",
    "不得因答案没有总起句而单独扣组织表达分"
  ],
  "质量等级": "A"
}
