{
  "schema_version": "1.2",
  "card_id": "sl-card-0078",
  "方法名": "工作指南事项内容配对",
  "方法层级": "题型工作流",
  "适用题型": [
    "贯彻执行"
  ],
  "适用模式": [
    "修改二稿",
    "审题",
    "批改",
    "解析"
  ],
  "适用环节": [
    "审题",
    "组织结构"
  ],
  "任务原型": "工作指南",
  "触发信号": [
    "要求写\"工作指南\"\"操作指南\"\"工作手册\"\"手册\"",
    "要求列出工作事项和具体内容"
  ],
  "材料结构特征": [
    "材料包含多个可提取的工作事项"
  ],
  "输入条件": [
    "题目文本",
    "材料文本"
  ],
  "诊断项": "事项与内容是否配对、是否可执行、指南与手册子类型是否匹配",
  "步骤逻辑": [
    "识别使用对象和文种子类型：指南侧重操作步骤和注意事项，手册侧重系统性的工具参考",
    "提取工作事项",
    "指南：为每个操作步骤匹配对象、动作、要求或注意点",
    "手册：按分类系统组织事项，每项说明用途和方法",
    "检查可执行性和完整性",
    "按使用顺序或分类逻辑组织"
  ],
  "常见错误": [
    "事项与内容不配对",
    "补充材料中不存在的操作细节",
    "把工作指南写成情况报告",
    "混淆指南的步骤性与手册的系统性"
  ],
  "修改动作": [
    "删除材料中无依据的操作细节",
    "补充缺失的事项—内容配对"
  ],
  "影响评分维度": [
    {
      "题型": "贯彻执行",
      "维度名": "内容覆盖",
      "影响程度": "高"
    },
    {
      "题型": "贯彻执行",
      "维度名": "结构",
      "影响程度": "中"
    },
    {
      "题型": "贯彻执行",
      "维度名": "身份文种格式",
      "影响程度": "中"
    }
  ],
  "输出产物": [
    "事项—内容配对清单",
    "指南或手册全文"
  ],
  "适用边界": [
    "仅适用于指南类文种：工作指南、操作指南、工作手册、手册",
    "指南侧重操作步骤与注意点，手册侧重系统性工具参考",
    "不得补充材料中不存在的操作细节"
  ],
  "质量等级": "A"
}
