{
  "schema_version": "1.2",
  "card_id": "sl-card-0041",
  "方法名": "经验介绍题型判断",
  "方法层级": "题型工作流",
  "适用题型": [
    "贯彻执行"
  ],
  "适用模式": [
    "修改二稿",
    "审题",
    "批改",
    "解析"
  ],
  "适用环节": [
    "审题"
  ],
  "任务原型": "经验介绍题",
  "触发信号": [
    "要求\"介绍经验\"\"总结做法\"",
    "将经验介绍写成问题分析"
  ],
  "材料结构特征": [
    "无明显结构特征要求"
  ],
  "输入条件": [
    "题目文本"
  ],
  "诊断项": "是否以做法为重点",
  "步骤逻辑": [
    "识别动词（介绍/总结）",
    "判断为经验介绍题",
    "确定作答重点为做法"
  ],
  "常见错误": [
    "将经验介绍写成问题分析"
  ],
  "修改动作": [
    "调整答案重点",
    "若重点错误，需调整"
  ],
  "影响评分维度": [
    {
      "题型": "贯彻执行",
      "维度名": "身份文种格式",
      "影响程度": "高"
    }
  ],
  "输出产物": [
    "题型判断"
  ],
  "适用边界": [
    "经验介绍题"
  ],
  "质量等级": "A"
}