{
  "schema_version": "1.2",
  "card_id": "sl-card-0028",
  "方法名": "观点明确的两种处理路径",
  "方法层级": "题型工作流",
  "适用题型": [
    "综合分析"
  ],
  "适用模式": [
    "修改二稿",
    "批改",
    "解析"
  ],
  "适用环节": [
    "组织结构"
  ],
  "任务原型": "综合分析题",
  "触发信号": [
    "要求\"观点明确\"",
    "观点模糊"
  ],
  "材料结构特征": [
    "无明显结构特征要求"
  ],
  "输入条件": [
    "题目文本"
  ],
  "诊断项": "观点是否明确",
  "步骤逻辑": [
    "判断是评价型还是理解型",
    "评价型：先表态再分析",
    "理解型：先解释再分析"
  ],
  "常见错误": [
    "观点模糊"
  ],
  "修改动作": [
    "调整观点表达",
    "若观点不明确，需调整"
  ],
  "影响评分维度": [
    {
      "题型": "综合分析",
      "维度名": "组织表达",
      "影响程度": "中"
    }
  ],
  "输出产物": [
    "观点处理策略"
  ],
  "适用边界": [
    "综合分析题"
  ],
  "质量等级": "A"
}