{
  "schema_version": "1.2",
  "card_id": "sl-card-0048",
  "方法名": "标题拟定法",
  "方法层级": "题型工作流",
  "适用题型": [
    "申发论述"
  ],
  "适用模式": [
    "审题",
    "解析",
    "批改",
    "修改二稿"
  ],
  "适用环节": [
    "要点提取"
  ],
  "任务原型": "申发论述题",
  "触发信号": [
    "需要自拟标题",
    "标题跑题"
  ],
  "材料结构特征": [
    "无明显结构特征要求"
  ],
  "输入条件": [
    "题目文本"
  ],
  "诊断项": "标题是否扣题",
  "步骤逻辑": [
    "判断命题形式（命题/半命题/话题）",
    "提取核心词",
    "拟定标题"
  ],
  "常见错误": [
    "标题跑题"
  ],
  "修改动作": [
    "调整标题",
    "若标题不扣题，需调整"
  ],
  "影响评分维度": [
    {
      "题型": "申发论述",
      "维度名": "立意扣题",
      "影响程度": "高"
    }
  ],
  "输出产物": [
    "标题"
  ],
  "适用边界": [
    "申发论述题"
  ],
  "质量等级": "A"
}