{
  "schema_version": "1.2",
  "card_id": "sl-card-0055",
  "方法名": "分论点带主题词防跑题",
  "方法层级": "批改二稿",
  "适用题型": [
    "申发论述"
  ],
  "适用模式": [
    "解析",
    "批改",
    "对照参考答案",
    "修改二稿"
  ],
  "适用环节": [
    "批改"
  ],
  "任务原型": "申发论述题",
  "触发信号": [
    "需要验证分论点",
    "分论点不含主题词"
  ],
  "材料结构特征": [
    "无明显结构特征要求"
  ],
  "输入条件": [
    "分论点"
  ],
  "诊断项": "分论点是否扣题",
  "步骤逻辑": [
    "检查分论点是否包含主题词",
    "若不包含，调整分论点"
  ],
  "常见错误": [
    "分论点不含主题词"
  ],
  "修改动作": [
    "调整分论点",
    "若分论点跑题，需调整"
  ],
  "影响评分维度": [
    {
      "题型": "申发论述",
      "维度名": "立意扣题",
      "影响程度": "中"
    },
    {
      "题型": "申发论述",
      "维度名": "论证深度",
      "影响程度": "中"
    }
  ],
  "输出产物": [
    "扣题的分论点"
  ],
  "适用边界": [
    "申发论述题"
  ],
  "质量等级": "A"
}