{
  "schema_version": "1.2",
  "card_id": "sl-card-0045",
  "方法名": "启示题四段结构法",
  "方法层级": "题型工作流",
  "适用题型": [
    "贯彻执行"
  ],
  "适用模式": [
    "修改二稿",
    "批改",
    "解析"
  ],
  "适用环节": [
    "组织结构"
  ],
  "任务原型": "启示题",
  "触发信号": [
    "要求\"总结启示\"",
    "只有并列没有总分"
  ],
  "材料结构特征": [
    "无明显结构特征要求"
  ],
  "输入条件": [
    "要点"
  ],
  "诊断项": "是否有总分结构",
  "步骤逻辑": [
    "总论点",
    "子论点一",
    "子论点二",
    "子论点三"
  ],
  "常见错误": [
    "只有并列没有总分"
  ],
  "修改动作": [
    "调整结构",
    "若结构混乱，需调整"
  ],
  "影响评分维度": [
    {
      "题型": "贯彻执行",
      "维度名": "结构",
      "影响程度": "中"
    }
  ],
  "输出产物": [
    "四段结构答案"
  ],
  "适用边界": [
    "启示题"
  ],
  "质量等级": "A"
}