{
  "schema_version": "1.2",
  "card_id": "sl-card-0046",
  "方法名": "文体判断法",
  "方法层级": "题型工作流",
  "适用题型": [
    "申发论述"
  ],
  "适用模式": [
    "修改二稿",
    "审题",
    "批改",
    "解析"
  ],
  "适用环节": [
    "审题"
  ],
  "任务原型": "申发论述题",
  "触发信号": [
    "要求\"写一篇文章\"",
    "将议论文写成记叙文或说明文"
  ],
  "材料结构特征": [
    "无明显结构特征要求"
  ],
  "输入条件": [
    "题目文本"
  ],
  "诊断项": "是否符合文体要求",
  "步骤逻辑": [
    "识别为议论文",
    "判断议论比例（5-8成）",
    "确定文体特征"
  ],
  "常见错误": [
    "将议论文写成记叙文或说明文"
  ],
  "修改动作": [
    "调整文体特征",
    "若文体不符，需调整"
  ],
  "影响评分维度": [
    {
      "题型": "申发论述",
      "维度名": "立意扣题",
      "影响程度": "高"
    }
  ],
  "输出产物": [
    "文体判断"
  ],
  "适用边界": [
    "申发论述题"
  ],
  "质量等级": "A"
}