{
  "schema_version": "1.2",
  "card_id": "sl-card-0039",
  "方法名": "过渡段/句识别",
  "方法层级": "题型工作流",
  "适用题型": [
    "贯彻执行"
  ],
  "适用模式": [
    "修改二稿",
    "批改",
    "解析"
  ],
  "适用环节": [
    "要点提取"
  ],
  "任务原型": "贯彻执行题",
  "触发信号": [
    "材料有过渡",
    "有短段落、居中位置、承启性",
    "忽略过渡段"
  ],
  "材料结构特征": [
    "有短段落、居中位置、承启性"
  ],
  "输入条件": [
    "材料文本"
  ],
  "诊断项": "是否遗漏过渡",
  "步骤逻辑": [
    "找短段落",
    "判断是否居中",
    "判断是否有承启性",
    "识别为过渡段/句"
  ],
  "常见错误": [
    "忽略过渡段"
  ],
  "修改动作": [
    "补充过渡",
    "若过渡缺失，需补充"
  ],
  "影响评分维度": [
    {
      "题型": "贯彻执行",
      "维度名": "内容覆盖",
      "影响程度": "高"
    }
  ],
  "输出产物": [
    "过渡段/句"
  ],
  "适用边界": [
    "贯彻执行题"
  ],
  "质量等级": "A"
}