{
  "schema_version": "1.2",
  "card_id": "sl-card-0049",
  "方法名": "分论点四步法",
  "方法层级": "题型工作流",
  "适用题型": [
    "申发论述"
  ],
  "适用模式": [
    "修改二稿",
    "批改",
    "解析"
  ],
  "适用环节": [
    "要点提取"
  ],
  "任务原型": "申发论述题",
  "触发信号": [
    "需要分论点",
    "分论点与总论点脱节"
  ],
  "材料结构特征": [
    "无明显结构特征要求"
  ],
  "输入条件": [
    "总论点、材料"
  ],
  "诊断项": "分论点是否扣题",
  "步骤逻辑": [
    "拆（拆解总论点）",
    "进（递进关系）",
    "扩（展开论述）",
    "补（补充论据）"
  ],
  "常见错误": [
    "分论点与总论点脱节"
  ],
  "修改动作": [
    "调整分论点",
    "若分论点跑题，需调整"
  ],
  "影响评分维度": [
    {
      "题型": "申发论述",
      "维度名": "材料运用",
      "影响程度": "高"
    },
    {
      "题型": "申发论述",
      "维度名": "论证深度",
      "影响程度": "中"
    }
  ],
  "输出产物": [
    "分论点"
  ],
  "适用边界": [
    "申发论述题"
  ],
  "质量等级": "A"
}