{
  "schema_version": "1.2",
  "card_id": "sl-card-0063",
  "方法名": "被封堵对策识别",
  "方法层级": "批改二稿",
  "适用题型": [
    "提出对策"
  ],
  "适用模式": [
    "修改二稿",
    "批改",
    "解析"
  ],
  "适用环节": [
    "要点提取"
  ],
  "任务原型": "提出对策题",
  "触发信号": [
    "材料有否定表态",
    "忽略否定表态"
  ],
  "材料结构特征": [
    "无明显结构特征要求"
  ],
  "输入条件": [
    "材料文本"
  ],
  "诊断项": "是否包含被封堵对策",
  "步骤逻辑": [
    "找否定表态",
    "识别被封堵的对策",
    "删除"
  ],
  "常见错误": [
    "忽略否定表态"
  ],
  "修改动作": [
    "删除被封堵对策",
    "若包含被封堵对策，需删除"
  ],
  "影响评分维度": [
    {
      "题型": "提出对策",
      "维度名": "问题诊断",
      "影响程度": "高"
    },
    {
      "题型": "提出对策",
      "维度名": "针对匹配",
      "影响程度": "中"
    }
  ],
  "输出产物": [
    "筛选后的对策"
  ],
  "适用边界": [
    "提出对策题"
  ],
  "质量等级": "B"
}