{
  "schema_version": "1.2",
  "card_id": "sl-card-0056",
  "方法名": "材料证据覆盖与失衡检查",
  "方法层级": "批改二稿",
  "适用题型": [
    "综合分析"
  ],
  "适用模式": [
    "解析",
    "批改",
    "对照参考答案",
    "修改二稿"
  ],
  "适用环节": [
    "批改"
  ],
  "任务原型": "综合分析题",
  "触发信号": [
    "关键证据可能遗漏或过度集中",
    "需要检查证据覆盖"
  ],
  "材料结构特征": [
    "有多个段落"
  ],
  "输入条件": [
    "答案、材料"
  ],
  "诊断项": "关键材料证据是否遗漏，是否过度依赖单一证据导致论证失衡",
  "步骤逻辑": [
    "检查关键材料证据是否遗漏",
    "检查是否过度依赖单一证据导致论证失衡",
    "不要求各段材料平均使用",
    "诊断对象是证据覆盖，不是形式均匀"
  ],
  "常见错误": [
    "要求各段材料平均使用",
    "把材料篇幅占比当作评分标准"
  ],
  "修改动作": [
    "补充遗漏的关键材料证据",
    "调整过度依赖单一证据的论证"
  ],
  "影响评分维度": [
    {
      "题型": "综合分析",
      "维度名": "关系逻辑",
      "影响程度": "中"
    }
  ],
  "输出产物": [
    "材料使用检查结果"
  ],
  "适用边界": [
    "综合分析题",
    "不要求平均使用每段材料",
    "材料篇幅占比不能直接决定得分"
  ],
  "质量等级": "A"
}
