{
  "schema_version": "1.2",
  "card_id": "sl-card-0051",
  "方法名": "分论点语义关联检查",
  "方法层级": "题型工作流",
  "适用题型": [
    "申发论述"
  ],
  "适用模式": [
    "修改二稿",
    "批改",
    "解析"
  ],
  "适用环节": [
    "要点提取"
  ],
  "任务原型": "申发论述题",
  "触发信号": [
    "需要选择分论点",
    "分论点与总论点关联松散"
  ],
  "材料结构特征": [
    "无明显结构特征要求"
  ],
  "输入条件": [
    "候选分论点"
  ],
  "诊断项": "分论点与总论点的语义关联是否紧密，分论点之间是否并列、交叉或偏题",
  "步骤逻辑": [
    "检查分论点与总论点的语义关联",
    "检查分论点之间是否并列、交叉或偏题",
    "调整语义关联不紧密的分论点",
    "不把抽象距离当作数值评分标准"
  ],
  "常见错误": [
    "以抽象距离量化分论点质量",
    "忽略分论点之间的逻辑关系"
  ],
  "修改动作": [
    "调整语义关联不紧密的分论点",
    "消除分论点交叉或重复"
  ],
  "影响评分维度": [
    {
      "题型": "申发论述",
      "维度名": "立意扣题",
      "影响程度": "高"
    },
    {
      "题型": "申发论述",
      "维度名": "结构",
      "影响程度": "中"
    }
  ],
  "输出产物": [
    "选定的分论点"
  ],
  "适用边界": [
    "申发论述题",
    "仅为辅助预判或复核信号，不构成固定答案格式，不得覆盖题目要求、材料证据和评分协议，不得因不符合经验数值直接扣分"
  ],
  "质量等级": "A"
}
