{
  "schema_version": "1.2",
  "card_id": "sl-card-0062",
  "方法名": "对策过多时的合并技术",
  "方法层级": "批改二稿",
  "适用题型": [
    "提出对策"
  ],
  "适用模式": [
    "修改二稿",
    "批改",
    "解析"
  ],
  "适用环节": [
    "表达"
  ],
  "任务原型": "提出对策题",
  "触发信号": [
    "对策过多",
    "合并导致丢失要点"
  ],
  "材料结构特征": [
    "无明显结构特征要求"
  ],
  "输入条件": [
    "对策清单"
  ],
  "诊断项": "是否丢失独立要点",
  "步骤逻辑": [
    "找交集词汇",
    "按交集合并",
    "核验是否丢失独立要点"
  ],
  "常见错误": [
    "合并导致丢失要点"
  ],
  "修改动作": [
    "调整合并",
    "若丢失要点，需调整"
  ],
  "影响评分维度": [
    {
      "题型": "提出对策",
      "维度名": "组织表达",
      "影响程度": "中"
    }
  ],
  "输出产物": [
    "合并后的对策"
  ],
  "适用边界": [
    "提出对策题"
  ],
  "质量等级": "B"
}