{
  "schema_version": "1.2",
  "card_id": "sl-card-0021",
  "方法名": "子焦点句式代入法",
  "方法层级": "题型工作流",
  "适用题型": [
    "归纳概括"
  ],
  "适用模式": [
    "审题",
    "解析",
    "批改",
    "修改二稿"
  ],
  "适用环节": [
    "要点提取"
  ],
  "任务原型": "争议概括题",
  "触发信号": [
    "要求概括\"争议\"\"双方意见\"",
    "有对立观点",
    "套用句式后不核验"
  ],
  "材料结构特征": [
    "有对立观点"
  ],
  "输入条件": [
    "材料文本"
  ],
  "诊断项": "是否遗漏焦点",
  "步骤逻辑": [
    "通读材料，标记讨论点",
    "套用句式（X是否Y？X能否Y？）",
    "句式通顺且有材料讨论依据的，保留为候选子焦点",
    "回到材料核验"
  ],
  "常见错误": [
    "套用句式后不核验"
  ],
  "修改动作": [
    "补充遗漏焦点",
    "若焦点遗漏，需补充"
  ],
  "影响评分维度": [
    {
      "题型": "归纳概括",
      "维度名": "要点覆盖",
      "影响程度": "高"
    },
    {
      "题型": "归纳概括",
      "维度名": "准确有据",
      "影响程度": "中"
    }
  ],
  "输出产物": [
    "候选子焦点"
  ],
  "适用边界": [
    "争议概括题"
  ],
  "质量等级": "A"
}