{
  "schema_version": "1.2",
  "card_id": "sl-card-0044",
  "方法名": "结论语义填充因果链法",
  "方法层级": "题型工作流",
  "适用题型": [
    "贯彻执行"
  ],
  "适用模式": [
    "修改二稿",
    "批改",
    "解析"
  ],
  "适用环节": [
    "组织结构"
  ],
  "任务原型": "贯彻执行题",
  "触发信号": [
    "需要写结论",
    "结论无逻辑"
  ],
  "材料结构特征": [
    "无明显结构特征要求"
  ],
  "输入条件": [
    "要点"
  ],
  "诊断项": "结论是否有因果链",
  "步骤逻辑": [
    "找因果关系",
    "按因果链递进填入",
    "形成结论"
  ],
  "常见错误": [
    "结论无逻辑"
  ],
  "修改动作": [
    "调整结论",
    "若结论散乱，需调整"
  ],
  "影响评分维度": [
    {
      "题型": "贯彻执行",
      "维度名": "结构",
      "影响程度": "中"
    }
  ],
  "输出产物": [
    "结论段"
  ],
  "适用边界": [
    "贯彻执行题"
  ],
  "质量等级": "A"
}