{
  "schema_version": "1.2",
  "card_id": "sl-card-0014",
  "方法名": "首尾句+最高级定位法",
  "方法层级": "题型工作流",
  "适用题型": [
    "综合分析"
  ],
  "适用模式": [
    "修改二稿",
    "批改",
    "解析"
  ],
  "适用环节": [
    "要点提取"
  ],
  "任务原型": "综合分析题",
  "触发信号": [
    "需要快速找点",
    "段首句或含\"最/极\"的句子",
    "忽略段首句或最高级"
  ],
  "材料结构特征": [
    "段首句或含\"最/极\"的句子"
  ],
  "输入条件": [
    "材料文本"
  ],
  "诊断项": "是否找到了核心句",
  "步骤逻辑": [
    "找段首句",
    "找含\"最/极\"的句子",
    "核验是否为核心句"
  ],
  "常见错误": [
    "忽略段首句或最高级"
  ],
  "修改动作": [
    "补充核心句",
    "若核心句缺失，需补充"
  ],
  "影响评分维度": [
    {
      "题型": "综合分析",
      "维度名": "要点覆盖",
      "影响程度": "高"
    },
    {
      "题型": "综合分析",
      "维度名": "关系逻辑",
      "影响程度": "中"
    }
  ],
  "输出产物": [
    "核心句"
  ],
  "适用边界": [
    "综合分析题"
  ],
  "质量等级": "A"
}