{
  "schema_version": "1.2",
  "card_id": "sl-card-0066",
  "方法名": "连读试探法",
  "方法层级": "批改二稿",
  "适用题型": [
    "贯彻执行"
  ],
  "适用模式": [
    "修改二稿",
    "批改",
    "解析"
  ],
  "适用环节": [
    "批改"
  ],
  "任务原型": "贯彻执行题",
  "触发信号": [
    "需要验证分类",
    "分类混乱"
  ],
  "材料结构特征": [
    "无明显结构特征要求"
  ],
  "输入条件": [
    "答案"
  ],
  "诊断项": "分类是否通顺",
  "步骤逻辑": [
    "将分类后的要点连读",
    "检查是否通顺",
    "调整分类"
  ],
  "常见错误": [
    "分类混乱"
  ],
  "修改动作": [
    "调整分类",
    "若不通顺，需调整"
  ],
  "影响评分维度": [
    {
      "题型": "贯彻执行",
      "维度名": "内容覆盖",
      "影响程度": "中"
    },
    {
      "题型": "贯彻执行",
      "维度名": "结构",
      "影响程度": "中"
    }
  ],
  "输出产物": [
    "验证结果"
  ],
  "适用边界": [
    "贯彻执行题"
  ],
  "质量等级": "A"
}