{
  "schema_version": "1.2",
  "card_id": "sl-card-0005",
  "方法名": "定性定量法",
  "方法层级": "能力内核",
  "适用题型": [
    "归纳概括",
    "综合分析",
    "提出对策",
    "贯彻执行",
    "申发论述"
  ],
  "适用模式": [
    "修改二稿",
    "批改",
    "解析"
  ],
  "适用环节": [
    "要点提取"
  ],
  "任务原型": "所有申论题目",
  "触发信号": [
    "要点过多、字数紧张",
    "只定性不定量，导致要点堆砌"
  ],
  "材料结构特征": [
    "无明显结构特征要求"
  ],
  "输入条件": [
    "候选要点池、字数要求"
  ],
  "诊断项": "是否遗漏关键要点",
  "步骤逻辑": [
    "定性：根据题干确定要找什么，在材料中划出所有相关内容",
    "定量：对要点进行层次划分（宏观→中观→微观），按重要性排序",
    "优先保留核心且可独立得分的要点",
    "次要信息优先压缩、合并，不直接删除",
    "是否取舍必须结合材料证据和字数限制"
  ],
  "常见错误": [
    "只定性不定量导致要点堆砌",
    "直接删除可独立得分的次要要点"
  ],
  "修改动作": [
    "补充遗漏的核心要点",
    "压缩而非删除次要信息",
    "合并同义要点以节省字数"
  ],
  "影响评分维度": [
    {
      "题型": "归纳概括",
      "维度名": "要点覆盖",
      "影响程度": "高"
    },
    {
      "题型": "归纳概括",
      "维度名": "准确有据",
      "影响程度": "中"
    },
    {
      "题型": "综合分析",
      "维度名": "要点覆盖",
      "影响程度": "高"
    },
    {
      "题型": "综合分析",
      "维度名": "关系逻辑",
      "影响程度": "中"
    },
    {
      "题型": "提出对策",
      "维度名": "问题诊断",
      "影响程度": "高"
    },
    {
      "题型": "提出对策",
      "维度名": "针对匹配",
      "影响程度": "中"
    },
    {
      "题型": "贯彻执行",
      "维度名": "内容覆盖",
      "影响程度": "高"
    },
    {
      "题型": "申发论述",
      "维度名": "材料运用",
      "影响程度": "高"
    },
    {
      "题型": "申发论述",
      "维度名": "论证深度",
      "影响程度": "中"
    }
  ],
  "输出产物": [
    "筛选后的要点清单"
  ],
  "适用边界": [
    "所有题型",
    "取舍必须基于材料证据和任务要求，不得仅凭字数压力删除可独立得分要点"
  ],
  "质量等级": "A"
}